{
  "schema_version": "1.0",
  "generated_at": "2026-06-20T23:15:47.574924+00:00",
  "software_version": "0.7.2",
  "title": "Synthetic DICOM privacy-audit demonstration",
  "synthetic_results": true,
  "paths_disclosed": false,
  "inputs": [
    {
      "path": "evaluation-baseline/evaluation.json",
      "sha256": "b55083b878d6887b5f45b94edb05de34194fdb053e919c927b46944e1eb6f934"
    },
    {
      "path": "evaluation-metadata-only/evaluation.json",
      "sha256": "46de989a27752845b0a85a0146b46ab08f4b9f6e210f2f86c1938f5023c1f800"
    },
    {
      "path": "evaluation-noop/evaluation.json",
      "sha256": "d425a5bb8d27b1eda12e81aa03860fae5f96182511e9e6cd05a056c1e96e3413"
    },
    {
      "path": "paired_comparisons.json",
      "sha256": "9d4c9b66795fe414ef61371de649b85d349f0988a277066d9c29b13a3b586ff7"
    },
    {
      "path": "human-review.db",
      "sha256": "b37e83112fd683a8f56d86c4e5999cca356d6dbc19e110bbcdb89d3d3c7c3d44"
    }
  ],
  "outputs": [
    {
      "path": "tables\\table_overall.csv",
      "sha256": "8f9a05562df937cd14de54a95fabcf8dd6276771b70a8589b19b91e182b3b832"
    },
    {
      "path": "tables\\table_overall.tex",
      "sha256": "68255fa75345b13d2338f151685b87839f820537fad1140af0f6850f0c45ddbe"
    },
    {
      "path": "tables\\table_by_stratum.csv",
      "sha256": "460fd59acfe8e15711d82badfd906cce6628bd7a9853ae3ea804bdb0218f63a0"
    },
    {
      "path": "tables\\table_by_stratum.tex",
      "sha256": "a9ef3a2f49bfcd72c2c1b3f4363ef6b4859884b67435a277885c65e3e948a06d"
    },
    {
      "path": "tables\\table_paired_comparisons.csv",
      "sha256": "9a73cfe8eed9292f3df14c25c0cc936f41047d2cebebb74a027df1bee20e9726"
    },
    {
      "path": "tables\\table_paired_comparisons.tex",
      "sha256": "5a45a8d0fbd39d5dcb2e539e3f65d01261e63ec92d1a4d1b0b72482734943d95"
    },
    {
      "path": "METHODS_TEMPLATE.md",
      "sha256": "203b762fd5c67b87a6d32bd961df829692473fb44014b9f09260e3e2ebb89093"
    },
    {
      "path": "MANUSCRIPT_REPORT.md",
      "sha256": "65052f1a4f3e416c7c232ef5da7c1cb42bd626709b3861f350be0a40ef568fe6"
    },
    {
      "path": "REPRODUCIBILITY_APPENDIX.md",
      "sha256": "61b9827e281df2068ce6d60285d0b6c28c8a6f3f9d9967a7acfaa5f128e69aed"
    },
    {
      "path": "figures\\overall_removal_rate.png",
      "sha256": "b33e247c3df760a0db97df199dfb509e63521cabe8886e861b9ca5222b2db3b5"
    }
  ],
  "review_summary": {
    "cases": 12,
    "case_statuses": {
      "pending": 12
    },
    "decision_statuses": {},
    "reviewers": []
  }
}
